{
  "schema_version": "1.0",
  "artifact_type": "feature_catalog",
  "generated_at": "2026-04-29T23:38:32.372Z",
  "recognition_policy": "conservative_config_evidence_only",
  "config_name": "hinge_block",
  "source_refs": [
    {
      "kind": "config",
      "path": "configs/examples/hinge_block.toml",
      "label": "Input config"
    },
    {
      "kind": "report",
      "path": "docs/examples/hinge-block/drawing/hinge_block_drawing.svg",
      "label": "Engineering report PDF"
    }
  ],
  "summary": {
    "total_features": 7,
    "recognized_features": 5,
    "unknown_features": 2,
    "recognition_sources": [
      "explicit_config_box_primary_candidate",
      "explicit_config_cut_cylinder",
      "explicit_config_shape_unclassified"
    ]
  },
  "features": [
    {
      "feature_id": "hinge_pin_left",
      "type": "hole",
      "source": "config.operations.cut_tool_cylinder",
      "recognition_source": "explicit_config_cut_cylinder",
      "confidence": 0.9,
      "critical": true,
      "related_config_path": "configs/examples/hinge_block.toml",
      "related_artifact": "docs/examples/hinge-block/drawing/hinge_block_drawing.svg",
      "dimensions": {
        "height_mm": 24,
        "radius_mm": 4,
        "diameter_mm": 8,
        "position_mm": [
          21,
          28,
          27
        ]
      },
      "evidence": {
        "kind": "config_operation",
        "operation_index": 2,
        "operation": "cut",
        "tool_shape_id": "hinge_pin_left",
        "tool_shape_type": "cylinder",
        "base": "body",
        "result": "body"
      }
    },
    {
      "feature_id": "hinge_pin_right",
      "type": "hole",
      "source": "config.operations.cut_tool_cylinder",
      "recognition_source": "explicit_config_cut_cylinder",
      "confidence": 0.9,
      "critical": true,
      "related_config_path": "configs/examples/hinge_block.toml",
      "related_artifact": "docs/examples/hinge-block/drawing/hinge_block_drawing.svg",
      "dimensions": {
        "height_mm": 24,
        "radius_mm": 4,
        "diameter_mm": 8,
        "position_mm": [
          69,
          28,
          27
        ]
      },
      "evidence": {
        "kind": "config_operation",
        "operation_index": 3,
        "operation": "cut",
        "tool_shape_id": "hinge_pin_right",
        "tool_shape_type": "cylinder",
        "base": "body",
        "result": "body"
      }
    },
    {
      "feature_id": "mount_hole_left",
      "type": "hole",
      "source": "config.operations.cut_tool_cylinder",
      "recognition_source": "explicit_config_cut_cylinder",
      "confidence": 0.9,
      "critical": true,
      "related_config_path": "configs/examples/hinge_block.toml",
      "related_artifact": "docs/examples/hinge-block/drawing/hinge_block_drawing.svg",
      "dimensions": {
        "height_mm": 18,
        "radius_mm": 3,
        "diameter_mm": 6,
        "position_mm": [
          24,
          14,
          -3
        ]
      },
      "evidence": {
        "kind": "config_operation",
        "operation_index": 4,
        "operation": "cut",
        "tool_shape_id": "mount_hole_left",
        "tool_shape_type": "cylinder",
        "base": "body",
        "result": "body"
      }
    },
    {
      "feature_id": "mount_hole_right",
      "type": "hole",
      "source": "config.operations.cut_tool_cylinder",
      "recognition_source": "explicit_config_cut_cylinder",
      "confidence": 0.9,
      "critical": true,
      "related_config_path": "configs/examples/hinge_block.toml",
      "related_artifact": "docs/examples/hinge-block/drawing/hinge_block_drawing.svg",
      "dimensions": {
        "height_mm": 18,
        "radius_mm": 3,
        "diameter_mm": 6,
        "position_mm": [
          66,
          14,
          -3
        ]
      },
      "evidence": {
        "kind": "config_operation",
        "operation_index": 5,
        "operation": "cut",
        "tool_shape_id": "mount_hole_right",
        "tool_shape_type": "cylinder",
        "base": "body",
        "result": "final"
      }
    },
    {
      "feature_id": "base_block",
      "type": "primary_body",
      "source": "config.shapes.box",
      "recognition_source": "explicit_config_box_primary_candidate",
      "confidence": 0.82,
      "critical": true,
      "related_config_path": "configs/examples/hinge_block.toml",
      "related_artifact": "docs/examples/hinge-block/drawing/hinge_block_drawing.svg",
      "dimensions": {
        "length_mm": 90,
        "width_mm": 50,
        "height_mm": 12
      },
      "evidence": {
        "kind": "config_shape",
        "shape_id": "base_block",
        "shape_type": "box",
        "primary_selection": "first_non_cut_box_or_named_base"
      }
    },
    {
      "feature_id": "left_ear",
      "type": "unknown",
      "source": "config.shapes.unclassified_solid",
      "recognition_source": "explicit_config_shape_unclassified",
      "confidence": 0.35,
      "critical": true,
      "related_config_path": "configs/examples/hinge_block.toml",
      "related_artifact": "docs/examples/hinge-block/drawing/hinge_block_drawing.svg",
      "dimensions": {
        "length_mm": 22,
        "width_mm": 14,
        "height_mm": 26,
        "position_mm": [
          10,
          32,
          12
        ]
      },
      "evidence": {
        "kind": "config_shape",
        "shape_id": "left_ear",
        "shape_type": "box",
        "reason": "Shape is explicit in config but not safely classifiable as a manufacturing feature yet."
      }
    },
    {
      "feature_id": "right_ear",
      "type": "unknown",
      "source": "config.shapes.unclassified_solid",
      "recognition_source": "explicit_config_shape_unclassified",
      "confidence": 0.35,
      "critical": true,
      "related_config_path": "configs/examples/hinge_block.toml",
      "related_artifact": "docs/examples/hinge-block/drawing/hinge_block_drawing.svg",
      "dimensions": {
        "length_mm": 22,
        "width_mm": 14,
        "height_mm": 26,
        "position_mm": [
          58,
          32,
          12
        ]
      },
      "evidence": {
        "kind": "config_shape",
        "shape_id": "right_ear",
        "shape_type": "box",
        "reason": "Shape is explicit in config but not safely classifiable as a manufacturing feature yet."
      }
    }
  ],
  "warnings": [
    "Some explicit config shapes or cut tools were left unknown because they are not safely classifiable yet."
  ]
}
