{
  "schema_version": "1.0",
  "artifact_type": "feature_catalog",
  "generated_at": "2026-04-27T02:24:39.557Z",
  "recognition_policy": "conservative_config_evidence_only",
  "config_name": "controller_housing_eol",
  "source_refs": [
    {
      "kind": "config",
      "path": "docs/examples/controller-housing-eol/config.toml",
      "label": "Input config"
    },
    {
      "kind": "report",
      "path": "docs/examples/controller-housing-eol/drawing/controller_housing_eol_drawing.svg",
      "label": "Engineering report PDF"
    }
  ],
  "summary": {
    "total_features": 9,
    "recognized_features": 6,
    "unknown_features": 3,
    "recognition_sources": [
      "explicit_config_box_primary_candidate",
      "explicit_config_cut_cylinder",
      "explicit_config_cut_tool_unclassified",
      "explicit_config_equal_radius_hole_group"
    ]
  },
  "features": [
    {
      "feature_id": "mount1",
      "type": "hole",
      "source": "config.operations.cut_tool_cylinder",
      "recognition_source": "explicit_config_cut_cylinder",
      "confidence": 0.9,
      "critical": true,
      "related_config_path": "docs/examples/controller-housing-eol/config.toml",
      "related_artifact": "docs/examples/controller-housing-eol/drawing/controller_housing_eol_drawing.svg",
      "dimensions": {
        "height_mm": 56,
        "radius_mm": 3,
        "diameter_mm": 6,
        "position_mm": [
          20,
          20,
          -4
        ]
      },
      "evidence": {
        "kind": "config_operation",
        "operation_index": 3,
        "operation": "cut",
        "tool_shape_id": "mount1",
        "tool_shape_type": "cylinder",
        "base": "body",
        "result": "body"
      }
    },
    {
      "feature_id": "mount2",
      "type": "hole",
      "source": "config.operations.cut_tool_cylinder",
      "recognition_source": "explicit_config_cut_cylinder",
      "confidence": 0.9,
      "critical": true,
      "related_config_path": "docs/examples/controller-housing-eol/config.toml",
      "related_artifact": "docs/examples/controller-housing-eol/drawing/controller_housing_eol_drawing.svg",
      "dimensions": {
        "height_mm": 56,
        "radius_mm": 3,
        "diameter_mm": 6,
        "position_mm": [
          152,
          20,
          -4
        ]
      },
      "evidence": {
        "kind": "config_operation",
        "operation_index": 4,
        "operation": "cut",
        "tool_shape_id": "mount2",
        "tool_shape_type": "cylinder",
        "base": "body",
        "result": "body"
      }
    },
    {
      "feature_id": "mount3",
      "type": "hole",
      "source": "config.operations.cut_tool_cylinder",
      "recognition_source": "explicit_config_cut_cylinder",
      "confidence": 0.9,
      "critical": true,
      "related_config_path": "docs/examples/controller-housing-eol/config.toml",
      "related_artifact": "docs/examples/controller-housing-eol/drawing/controller_housing_eol_drawing.svg",
      "dimensions": {
        "height_mm": 56,
        "radius_mm": 3,
        "diameter_mm": 6,
        "position_mm": [
          20,
          106,
          -4
        ]
      },
      "evidence": {
        "kind": "config_operation",
        "operation_index": 5,
        "operation": "cut",
        "tool_shape_id": "mount3",
        "tool_shape_type": "cylinder",
        "base": "body",
        "result": "body"
      }
    },
    {
      "feature_id": "mount4",
      "type": "hole",
      "source": "config.operations.cut_tool_cylinder",
      "recognition_source": "explicit_config_cut_cylinder",
      "confidence": 0.9,
      "critical": true,
      "related_config_path": "docs/examples/controller-housing-eol/config.toml",
      "related_artifact": "docs/examples/controller-housing-eol/drawing/controller_housing_eol_drawing.svg",
      "dimensions": {
        "height_mm": 56,
        "radius_mm": 3,
        "diameter_mm": 6,
        "position_mm": [
          152,
          106,
          -4
        ]
      },
      "evidence": {
        "kind": "config_operation",
        "operation_index": 6,
        "operation": "cut",
        "tool_shape_id": "mount4",
        "tool_shape_type": "cylinder",
        "base": "body",
        "result": "final"
      }
    },
    {
      "feature_id": "hole_pattern_1",
      "type": "hole_pattern",
      "source": "config.operations.cut_tool_cylinder_group",
      "recognition_source": "explicit_config_equal_radius_hole_group",
      "confidence": 0.78,
      "critical": true,
      "related_config_path": "docs/examples/controller-housing-eol/config.toml",
      "related_artifact": "docs/examples/controller-housing-eol/drawing/controller_housing_eol_drawing.svg",
      "dimensions": {
        "count": 4,
        "diameter_mm": 6,
        "member_feature_ids": [
          "mount1",
          "mount2",
          "mount3",
          "mount4"
        ],
        "center_positions_mm": [
          [
            20,
            20,
            -4
          ],
          [
            152,
            20,
            -4
          ],
          [
            20,
            106,
            -4
          ],
          [
            152,
            106,
            -4
          ]
        ],
        "spacing_x_mm": 132,
        "spacing_y_mm": 86
      },
      "evidence": {
        "kind": "config_feature_group",
        "rule": "same_radius_cut_cylinders",
        "member_shape_ids": [
          "mount1",
          "mount2",
          "mount3",
          "mount4"
        ]
      }
    },
    {
      "feature_id": "housing",
      "type": "primary_body",
      "source": "config.shapes.box",
      "recognition_source": "explicit_config_box_primary_candidate",
      "confidence": 0.62,
      "critical": true,
      "related_config_path": "docs/examples/controller-housing-eol/config.toml",
      "related_artifact": "docs/examples/controller-housing-eol/drawing/controller_housing_eol_drawing.svg",
      "dimensions": {
        "length_mm": 172,
        "width_mm": 126,
        "height_mm": 50
      },
      "evidence": {
        "kind": "config_shape",
        "shape_id": "housing",
        "shape_type": "box",
        "primary_selection": "first_non_cut_box_or_named_base"
      }
    },
    {
      "feature_id": "cavity",
      "type": "unknown_cut_feature",
      "source": "config.operations.cut_tool_unclassified",
      "recognition_source": "explicit_config_cut_tool_unclassified",
      "confidence": 0.45,
      "critical": true,
      "related_config_path": "docs/examples/controller-housing-eol/config.toml",
      "related_artifact": "docs/examples/controller-housing-eol/drawing/controller_housing_eol_drawing.svg",
      "dimensions": {
        "length_mm": 142,
        "width_mm": 96,
        "height_mm": 34,
        "position_mm": [
          15,
          15,
          8
        ]
      },
      "evidence": {
        "kind": "config_operation",
        "operation_index": 0,
        "operation": "cut",
        "tool_shape_id": "cavity",
        "tool_shape_type": "box",
        "reason": "Cut tool is explicit but not safely identifiable as a hole or slot."
      }
    },
    {
      "feature_id": "connector_port",
      "type": "unknown_cut_feature",
      "source": "config.operations.cut_tool_unclassified",
      "recognition_source": "explicit_config_cut_tool_unclassified",
      "confidence": 0.45,
      "critical": true,
      "related_config_path": "docs/examples/controller-housing-eol/config.toml",
      "related_artifact": "docs/examples/controller-housing-eol/drawing/controller_housing_eol_drawing.svg",
      "dimensions": {
        "length_mm": 42,
        "width_mm": 30,
        "height_mm": 18,
        "position_mm": [
          118,
          46,
          10
        ]
      },
      "evidence": {
        "kind": "config_operation",
        "operation_index": 1,
        "operation": "cut",
        "tool_shape_id": "connector_port",
        "tool_shape_type": "box",
        "reason": "Cut tool is explicit but not safely identifiable as a hole or slot."
      }
    },
    {
      "feature_id": "seal_interface",
      "type": "unknown_cut_feature",
      "source": "config.operations.cut_tool_unclassified",
      "recognition_source": "explicit_config_cut_tool_unclassified",
      "confidence": 0.45,
      "critical": true,
      "related_config_path": "docs/examples/controller-housing-eol/config.toml",
      "related_artifact": "docs/examples/controller-housing-eol/drawing/controller_housing_eol_drawing.svg",
      "dimensions": {
        "length_mm": 150,
        "width_mm": 104,
        "height_mm": 2.4,
        "position_mm": [
          11,
          11,
          47.6
        ]
      },
      "evidence": {
        "kind": "config_operation",
        "operation_index": 2,
        "operation": "cut",
        "tool_shape_id": "seal_interface",
        "tool_shape_type": "box",
        "reason": "Cut tool is explicit but not safely identifiable as a hole or slot."
      }
    }
  ],
  "warnings": [
    "Some explicit config shapes or cut tools were left unknown because they are not safely classifiable yet."
  ]
}
