{
  "schema_version": "1.0",
  "artifact_type": "feature_catalog",
  "generated_at": "2026-04-27T00:28:17.820Z",
  "recognition_policy": "conservative_config_evidence_only",
  "config_name": "cnc_motor_mount_bracket",
  "source_refs": [
    {
      "kind": "config",
      "path": "docs/examples/motor-mount/config.toml",
      "label": "Input config"
    },
    {
      "kind": "report",
      "path": "docs/examples/motor-mount/drawing/cnc_motor_mount_bracket_drawing.svg",
      "label": "Engineering report PDF"
    }
  ],
  "summary": {
    "total_features": 8,
    "recognized_features": 6,
    "unknown_features": 2,
    "recognition_sources": [
      "explicit_config_box_primary_candidate",
      "explicit_config_cut_cylinder",
      "explicit_config_equal_radius_hole_group",
      "explicit_config_shape_unclassified"
    ]
  },
  "features": [
    {
      "feature_id": "mount_hole_1",
      "type": "hole",
      "source": "config.operations.cut_tool_cylinder",
      "recognition_source": "explicit_config_cut_cylinder",
      "confidence": 0.9,
      "critical": true,
      "related_config_path": "docs/examples/motor-mount/config.toml",
      "related_artifact": "docs/examples/motor-mount/drawing/cnc_motor_mount_bracket_drawing.svg",
      "dimensions": {
        "height_mm": 16,
        "radius_mm": 4.5,
        "diameter_mm": 9,
        "position_mm": [
          20,
          15,
          -3
        ]
      },
      "evidence": {
        "kind": "config_operation",
        "operation_index": 2,
        "operation": "cut",
        "tool_shape_id": "mount_hole_1",
        "tool_shape_type": "cylinder",
        "base": "body",
        "result": "body"
      }
    },
    {
      "feature_id": "mount_hole_2",
      "type": "hole",
      "source": "config.operations.cut_tool_cylinder",
      "recognition_source": "explicit_config_cut_cylinder",
      "confidence": 0.9,
      "critical": true,
      "related_config_path": "docs/examples/motor-mount/config.toml",
      "related_artifact": "docs/examples/motor-mount/drawing/cnc_motor_mount_bracket_drawing.svg",
      "dimensions": {
        "height_mm": 16,
        "radius_mm": 4.5,
        "diameter_mm": 9,
        "position_mm": [
          100,
          15,
          -3
        ]
      },
      "evidence": {
        "kind": "config_operation",
        "operation_index": 3,
        "operation": "cut",
        "tool_shape_id": "mount_hole_2",
        "tool_shape_type": "cylinder",
        "base": "body",
        "result": "body"
      }
    },
    {
      "feature_id": "mount_hole_3",
      "type": "hole",
      "source": "config.operations.cut_tool_cylinder",
      "recognition_source": "explicit_config_cut_cylinder",
      "confidence": 0.9,
      "critical": true,
      "related_config_path": "docs/examples/motor-mount/config.toml",
      "related_artifact": "docs/examples/motor-mount/drawing/cnc_motor_mount_bracket_drawing.svg",
      "dimensions": {
        "height_mm": 16,
        "radius_mm": 4.5,
        "diameter_mm": 9,
        "position_mm": [
          20,
          65,
          -3
        ]
      },
      "evidence": {
        "kind": "config_operation",
        "operation_index": 4,
        "operation": "cut",
        "tool_shape_id": "mount_hole_3",
        "tool_shape_type": "cylinder",
        "base": "body",
        "result": "body"
      }
    },
    {
      "feature_id": "mount_hole_4",
      "type": "hole",
      "source": "config.operations.cut_tool_cylinder",
      "recognition_source": "explicit_config_cut_cylinder",
      "confidence": 0.9,
      "critical": true,
      "related_config_path": "docs/examples/motor-mount/config.toml",
      "related_artifact": "docs/examples/motor-mount/drawing/cnc_motor_mount_bracket_drawing.svg",
      "dimensions": {
        "height_mm": 16,
        "radius_mm": 4.5,
        "diameter_mm": 9,
        "position_mm": [
          100,
          65,
          -3
        ]
      },
      "evidence": {
        "kind": "config_operation",
        "operation_index": 5,
        "operation": "cut",
        "tool_shape_id": "mount_hole_4",
        "tool_shape_type": "cylinder",
        "base": "body",
        "result": "final"
      }
    },
    {
      "feature_id": "hole_pattern_1",
      "type": "hole_pattern",
      "source": "config.operations.cut_tool_cylinder_group",
      "recognition_source": "explicit_config_equal_radius_hole_group",
      "confidence": 0.78,
      "critical": true,
      "related_config_path": "docs/examples/motor-mount/config.toml",
      "related_artifact": "docs/examples/motor-mount/drawing/cnc_motor_mount_bracket_drawing.svg",
      "dimensions": {
        "count": 4,
        "diameter_mm": 9,
        "member_feature_ids": [
          "mount_hole_1",
          "mount_hole_2",
          "mount_hole_3",
          "mount_hole_4"
        ],
        "center_positions_mm": [
          [
            20,
            15,
            -3
          ],
          [
            100,
            15,
            -3
          ],
          [
            20,
            65,
            -3
          ],
          [
            100,
            65,
            -3
          ]
        ],
        "spacing_x_mm": 80,
        "spacing_y_mm": 50
      },
      "evidence": {
        "kind": "config_feature_group",
        "rule": "same_radius_cut_cylinders",
        "member_shape_ids": [
          "mount_hole_1",
          "mount_hole_2",
          "mount_hole_3",
          "mount_hole_4"
        ]
      }
    },
    {
      "feature_id": "base_plate",
      "type": "primary_body",
      "source": "config.shapes.box",
      "recognition_source": "explicit_config_box_primary_candidate",
      "confidence": 0.82,
      "critical": true,
      "related_config_path": "docs/examples/motor-mount/config.toml",
      "related_artifact": "docs/examples/motor-mount/drawing/cnc_motor_mount_bracket_drawing.svg",
      "dimensions": {
        "length_mm": 120,
        "width_mm": 80,
        "height_mm": 10
      },
      "evidence": {
        "kind": "config_shape",
        "shape_id": "base_plate",
        "shape_type": "box",
        "primary_selection": "first_non_cut_box_or_named_base"
      }
    },
    {
      "feature_id": "support_web",
      "type": "unknown",
      "source": "config.shapes.unclassified_solid",
      "recognition_source": "explicit_config_shape_unclassified",
      "confidence": 0.35,
      "critical": true,
      "related_config_path": "docs/examples/motor-mount/config.toml",
      "related_artifact": "docs/examples/motor-mount/drawing/cnc_motor_mount_bracket_drawing.svg",
      "dimensions": {
        "length_mm": 12,
        "width_mm": 80,
        "height_mm": 60,
        "position_mm": [
          0,
          0,
          8
        ]
      },
      "evidence": {
        "kind": "config_shape",
        "shape_id": "support_web",
        "shape_type": "box",
        "reason": "Shape is explicit in config but not safely classifiable as a manufacturing feature yet."
      }
    },
    {
      "feature_id": "support_rib",
      "type": "unknown",
      "source": "config.shapes.unclassified_solid",
      "recognition_source": "explicit_config_shape_unclassified",
      "confidence": 0.35,
      "critical": true,
      "related_config_path": "docs/examples/motor-mount/config.toml",
      "related_artifact": "docs/examples/motor-mount/drawing/cnc_motor_mount_bracket_drawing.svg",
      "dimensions": {
        "length_mm": 36,
        "width_mm": 80,
        "height_mm": 36,
        "position_mm": [
          42,
          0,
          8
        ]
      },
      "evidence": {
        "kind": "config_shape",
        "shape_id": "support_rib",
        "shape_type": "box",
        "reason": "Shape is explicit in config but not safely classifiable as a manufacturing feature yet."
      }
    }
  ],
  "warnings": [
    "Some explicit config shapes or cut tools were left unknown because they are not safely classifiable yet."
  ]
}
